Rank,Title,Rating,Summary
140,  Elysium,6.6,"In the year 2154, the very wealthy live on a man-made space station while the rest of the population resides on a ruined Earth. A man takes on a mission that could bring equality to the polarized worlds."
141,  The Da Vinci Code,6.6,A murder and clues in paintings lead to the discovery of a closely guarded religious mystery.
142,  The Hunger Games: Mockingjay - Part 1,6.6,"Katniss Everdeen is in District 13 after she shatters the games forever. Under the leadership of President Coin and the advice of her trusted friends, Katniss spreads her wings as she fights to save Peeta and a nation moved by her courage."
143,  Ocean's Twelve,6.5,Daniel Ocean recruits one more team member so he can pull off three major European heists in this sequel to Ocean's Eleven (2001).
144,  Smith,6.5,"A husband and wife struggle to keep their marriage alive until they realize they are both secretly working as assassins. Now, their respective assignments require them to kill each other."
145,  The Day After Tomorrow,6.5,"Jack Hall, paleoclimatologist, must make a daring trek from Washington, D.C. to New York City to reach his son, trapped in the cross-hairs of a sudden international storm which plunges the planet into a new Ice Age."
146,  Quantum of Solace,6.5,James Bond tries to stop an organisation from eliminating a country's most valuable resource.
147,  Godzilla,6.4,"The world is beset by the appearance of monstrous creatures, but one of them may be the only one who can save humanity."
148,  Lucy,6.4,"A woman, accidentally caught in a dark deal, turns the tables on her captors and transforms into a merciless warrior evolved beyond human logic."
149,  Transformers: Dark of the Moon,6.2,"The Autobots learn of a Cybertronian spacecraft hidden on the moon, and race against the Decepticons to reach it and to learn its secrets."
150,  Mission: Impossible II,6.1,"IMF agent Ethan Hunt is sent to Sydney to find and destroy a genetically modified disease called ""Chimera""."
