Rank,Title,Rating,Summary
1,  The Dark Knight,9.1,"When a menace known as the Joker wreaks havoc and chaos on the people of Gotham, Batman, James Gordon and Harvey Dent must work together to put an end to the madness."
2,  Inception,8.8,"A thief who steals corporate secrets through the use of dream-sharing technology is given the inverse task of planting an idea into the mind of a C.E.O., but his tragic past may doom the project and his team to disaster."
3,  Fight Club,8.8,An insomniac office worker and a devil-may-care soap maker form an underground fight club that evolves into much more.
4,  Se7en,8.6,"Two detectives, a rookie and a veteran, hunt a serial killer who uses the seven deadly sins as his motives."
5,  The Silence of the Lambs,8.6,"A young F.B.I. cadet must receive the help of an incarcerated and manipulative cannibal killer to help catch another serial killer, a madman who skins his victims."
6,  The Departed,8.5,An undercover cop and a mole in the police attempt to identify each other while infiltrating an Irish gang in South Boston.
7,  Léon: The Professional,8.5,An Italian hit man protects a New York orphan.
8,  The Usual Suspects,8.5,The sole survivor of a pier shoot-out tells the story of how a notorious criminal influenced the events that began with five criminals meeting in a seemingly random police lineup.
9,  Parasite,8.5,Greed and class discrimination threaten the newly formed symbiotic relationship between the wealthy Park family and the destitute Kim clan.
10,  Psycho,8.5,A secretary on the run for embezzlement takes refuge at a secluded California motel owned by a repressed man and his overbearing mother.
11,  Rear Window,8.5,A bored photographer recovering from a broken leg passes the time by watching his neighbors and begins to suspect one of them of murder.
12,  The Prestige,8.5,Rival 19th-century magicians engage in a bitter battle for trade secrets.
13,  Memento,8.4,A former insurance investigator who now suffers from anterograde amnesia uses notes and tattoos to hunt down his wife's murderer.
14,  The Lives of Others,8.4,"In 1984 East Berlin, an agent of the secret police conducting surveillance on a writer and his lover finds himself becoming increasingly absorbed by their lives."
15,  Aliens,8.4,"Decades after surviving the Nostromo incident, Ellen Ripley is sent out to re-establish contact with a terraforming colony but finds herself battling the Alien Queen and her offspring."
16,  The Dark Knight Rises,8.4,"Bane, an imposing terrorist, attacks Gotham City and disrupts its eight-year-long period of peace. This forces Bruce Wayne to come out of hiding and don the cape and cowl of Batman again."
17,  Reservoir Dogs,8.3,"When a simple jewelry heist goes horribly wrong, the surviving criminals begin to suspect that one of them is a police informant."
18,  Oldboy,8.3,"After being kidnapped and imprisoned for fifteen years, Oh Dae-Su is released, only to find that he must track down his captor in five days."
19,  Joker,8.3,"Arthur Fleck, a party clown and a failed stand-up comedian, leads an impoverished life with his ailing mother. However, when society shuns him and brands him as a freak, he decides to embrace the life of chaos in Gotham City."
20,  Vertigo,8.2,"A former San Francisco police detective juggles wrestling with his personal demons and becoming obsessed with the hauntingly beautiful woman he has been hired to trail, who may be deeply disturbed."
21,1,8.2,"After waking from a four-year coma, a former assassin wreaks vengeance on the team of assassins who betrayed her."
22,  No Country for Old Men,8.2,Violence and mayhem ensue after a hunter stumbles upon the aftermath of a drug deal gone wrong and over two million dollars in cash near the Rio Grande.
23,  Jurassic Park,8.2,"An industrialist invites some experts to visit his theme park of cloned dinosaurs. After a power failure, the creatures run loose, putting everyone's lives, including his grandchildren's, in danger."
24,  The Sixth Sense,8.2,"After being shot by a resentful former patient whom he failed to help, a Philadelphia child psychologist seeks redemption by treating a young boy with a disturbing secret."
25,  Die Hard,8.2,"A New York City cop, John McClane, tries to save his estranged wife and several others taken hostage by terrorists during a Christmas Eve party at the Nakatomi Plaza Skyscraper in Los Angeles, California."
26,  Prisoners,8.2,A desperate father takes the law into his own hands after police fail to find two kidnapped girls.
27,  Batman Begins,8.2,"After witnessing his parents' death, billionaire Bruce Wayne learns the art of fighting to confront injustice. When he returns to Gotham as Batman, he must stop a secret society that intends to destroy the city."
28,  Confidential,8.2,"As corruption grows in 1950s Los Angeles, three policemen - one strait-laced, one brutal, and one sleazy - investigate a series of murders with their own brand of justice."
29,  Shutter Island,8.2,Two US marshals are sent to a mental institution on an inhospitable island in order to investigate the disappearance of a patient.
30,  Room,8.1,"A little boy is held captive in a room with his mother since his birth, so he has never known the world outside."
31,  V for Vendetta,8.1,"In a future British dystopian society, a shadowy freedom fighter, known only by the alias of ""V"", plots to overthrow the tyrannical government - with the help of a young woman."
32,  Gone Girl,8.1,The husband of a missing woman becomes the main suspect in her disappearance.
33,  Logan,8.1,"In a future where mutants are nearly extinct, an elderly and weary Logan leads a quiet life. But when Laura, a mutant child pursued by scientists, comes to him for help, he must get her to safety."
34,  Blade Runner,8.1,A blade runner must pursue and terminate four replicants who stole a ship in space and have returned to Earth to find their creator.
35,  Fargo,8.1,Minnesota car salesman Jerry Lundegaard's inept crime falls apart due to his and his henchmen's bungling and the persistent police work of the quite pregnant Marge Gunderson.
36,  Jaws,8.1,"When a massive killer shark unleashes chaos on a beach community off Long Island, it's up to the local police chief, a marine biologist, and an old seafarer to hunt the beast down."
37,  Donnie Darko,8,"After narrowly escaping a bizarre accident, a troubled teenager is plagued by visions of a man in a large rabbit suit who manipulates him to commit a series of crimes."
38,  Black Swan,8,"Nina is a talented but unstable ballerina on the verge of stardom. Pushed to the breaking point by her artistic director and a seductive rival, Nina's grip on reality slips, plunging her into a waking nightmare."
39,  The Imitation Game,8,"During World War II, the English mathematical genius Alan Turing tries to crack the German Enigma code with help from fellow mathematicians while attempting to come to terms with his troubled private life."
40,2,8,"The Bride continues her quest of vengeance against her former boss and lover Bill, the reclusive bouncer Budd, and the treacherous, one-eyed Elle."
41,  Sin City,8,"An exploration of the dark and miserable Basin City and three of its residents, all of whom are caught up in violent corruption."
42,  Blade Runner 2049,8,"Young Blade Runner K's discovery of a long-buried secret leads him to track down former Blade Runner Rick Deckard, who's been missing for thirty years."
43,  Casino Royale,8,"After earning a licence to kill, secret agent James Bond sets out on his first mission as 007. Bond must defeat a private banker funding terrorists in a high-stakes game of poker at Casino Royale, in Montenegro."
44,  The Bourne Ultimatum,8,Jason Bourne dodges a ruthless C.I.A. official and his Agents from a new assassination program while searching for the origins of his life as a trained killer.
45,  12 Monkeys,8,"In a future world devastated by disease, a convict is sent back in time to gather information about the man-made virus that wiped out most of the human population on the planet."
46,  Blood Diamond,8,"A fisherman, a smuggler, and a syndicate of businessmen match wits over the possession of a priceless diamond."
47,  In Bruges,7.9,"After a job gone wrong, hitman Ray and his partner await orders from their ruthless boss in Bruges, Belgium, the last place in the world Ray wants to be."
48,  Mulholland Drive,7.9,"After a car wreck on Mulholland Drive renders a woman amnesiac, she and a Hollywood-hopeful search for clues and answers across Los Angeles in a twisting venture beyond dreams and reality."
49,  Knives Out,7.9,"When renowned crime novelist Harlan Thrombey is found dead at his estate just after his 85th birthday, the inquisitive and debonair Detective Benoit Blanc is mysteriously enlisted to investigate."
50,  X-Men: Days of Future Past,7.9,The X-Men send Wolverine to the past in a desperate effort to change history and prevent an event that results in doom for both humans and mutants.
51,  District 9,7.9,"In a future Earth in which aliens are isolated in a remote ghetto, a government agent finds himself banished there."
52,  Children of Men,7.9,"In 2027, in a chaotic world in which women have somehow become infertile, a former activist agrees to help transport a miraculously pregnant woman to a sanctuary at sea."
53,  Mystic River,7.9,"The tragic murder of a 19-year-old girl reunites three childhood friends still living in Boston--the victim's gangster father, a detective, and the disturbed man they both suspect of killing her."
54,  The Irishman,7.8,"An illustration of Frank Sheeran's life, from W.W.II veteran to hit-man for the Bufalino crime family and his alleged assassination of his close friend Jimmy Hoffa."
55,  The Batman,7.8,"When a sadistic serial killer begins murdering key political figures in Gotham, the Batman is forced to investigate the city's hidden corruption and question his family's involvement."
56,  Dunkirk,7.8,"Allied soldiers from Belgium, the British Commonwealth and Empire, and France are surrounded by the German Army and evacuated during a fierce battle in World War II."
57,  Get Out,7.8,"A young African-American visits his white girlfriend's parents for the weekend, where his simmering uneasiness about their reception of him eventually reaches a boiling point."
58,  Skyfall,7.8,"James Bond's loyalty to M is tested when her past comes back to haunt her. When MI6 comes under attack, 007 must track down and destroy the threat, no matter how personal the cost."
59,  The Hateful Eight,7.8,"In the dead of a Wyoming winter, a bounty hunter and his prisoner find shelter in a cabin currently inhabited by a collection of nefarious characters."
60,  Nightcrawler,7.8,A petty thief desperate for work muscles into the world of crime journalism and becomes the star of his own story as he blurs the line between observer and participant.
61,  The Bourne Identity,7.8,"A man is picked up by a fishing boat, bullet-riddled and suffering from amnesia, before racing to elude assassins and attempting to regain his memory."
62,  Hot Fuzz,7.8,"An overachieving London police sergeant is transferred to a village where the easygoing officers object to his fervor for regulations, all while a string of grisly murders strikes the town."
63,  The Girl with the Dragon Tattoo,7.8,Journalist Mikael Blomkvist is aided in his search for a woman who has been missing for 40 years by hacker Lisbeth Salander.
64,  Captain Phillips,7.8,"The true story of Captain Richard Phillips and the 2009 hijacking by Somali pirates of the U.S.-flagged MV Maersk Alabama, the first American cargo ship to be hijacked in two hundred years."
65,  Training Day,7.8,A rookie cop spends his first day as a Los Angeles narcotics officer with a rogue detective who isn't what he appears to be.
66,  The Game,7.7,A mysterious game invades a man's ordered existence.
67,  Crash,7.7,Racial tensions collide in a collection of intertwined stories involving residents of Los Angeles.
68,  Mission: Impossible - Fallout,7.7,"A group of terrorists plans to detonate three plutonium cores for a simultaneous nuclear attack on different cities. Ethan Hunt, along with his IMF team, sets out to stop the carnage."
69,  Man on Fire,7.7,"In Mexico City, a former CIA operative swears vengeance on those who committed an unspeakable act against the family he was hired to protect."
70,  Captain America: The Winter Soldier,7.7,"As Steve Rogers struggles to embrace his role in the modern world, he teams up with a fellow Avenger and S.H.I.E.L.D agent, Black Widow, to battle a new threat from history: an assassin known as the Winter Soldier."
71,  Gravity,7.7,"Dr Ryan Stone, an engineer on her first space mission, and Matt Kowalski, an astronaut on his final expedition, have to survive in space after they are hit by debris while spacewalking."
72,  Kingsman: The Secret Service,7.7,"A spy organisation recruits a promising street kid into the agency's training program, while a global threat emerges from a twisted tech genius."
73,  Taken,7.7,"A retired CIA agent travels across Europe and relies on his old skills to save his estranged daughter, who has been kidnapped while on a trip to Paris."
74,  Ocean's Eleven,7.7,"Danny Ocean, a gangster, rounds up a gang of associates to stage a sophisticated and elaborate casino heist which involves robbing three Las Vegas casinos simultaneously during a popular boxing event."
75,  Argo,7.7,"Acting under the cover of a Hollywood producer scouting a location for a science fiction film, a CIA agent launches a dangerous operation to rescue six Americans in Tehran during the U.S. hostage crisis in Iran in 1979."
76,  Zodiac,7.7,"Between 1968 and 1983, a San Francisco cartoonist becomes an amateur detective obsessed with tracking down the Zodiac Killer, an unidentified individual who terrorizes Northern California with a killing spree."
77,  Ex Machina,7.7,A young programmer is selected to participate in a ground-breaking experiment in synthetic intelligence by evaluating the human qualities of a highly advanced humanoid A.I.
78,  Sicario,7.7,An idealistic FBI agent is enlisted by a government task force to aid in the escalating war against drugs at the border area between the U.S. and Mexico.
79,  The Bourne Supremacy,7.7,"When Jason Bourne is framed for a CIA operation gone awry, he is forced to resume his former life as a trained assassin to survive."
80,  The Machinist,7.6,An industrial worker who hasn't slept in a year begins to doubt his own sanity.
81,  Die Hard with a Vengeance,7.6,"John McClane is forced out of suspension to play a game of ""Simon Says"" by a terrorist who has planted bombs all around New York City and will detonate them if McClane doesn't do what he says."
82,  Inside Man,7.6,"A police detective, a bank robber and a high-power broker enter high-stakes negotiations after the criminal's brilliant heist spirals into a hostage situation."
83,  The Others,7.6,"In 1945, immediately following the end of Second World War, a woman who lives with her two photosensitive children on her darkened old family estate in the Channel Islands becomes convinced that the home is haunted."
84,  Minority Report,7.6,"John works with the PreCrime police which stop crimes before they take place, with the help of three 'PreCogs' who can foresee crimes. Events ensue when John finds himself framed for a future murder."
85,  Rise of the Planet of the Apes,7.6,A substance designed to help the brain repair itself gives advanced intelligence to a chimpanzee who leads an ape uprising.
86,  The Butterfly Effect,7.6,"Evan Treborn suffers blackouts during significant events of his life. As he grows up, he finds a way to remember these lost memories and a supernatural way to alter his life by reading his journal."
87,  Dawn of the Planet of the Apes,7.6,The fragile peace between apes and humans is threatened as mistrust and betrayal threaten to plunge both tribes into a war for dominance over the Earth.
88,  Saw,7.6,"Two men awaken to find themselves on the opposite sides of a dead body, each with specific instructions to kill the other, escape or face the consequences. These two are the latest contestants in Jigsaw's games."
89,  Collateral,7.5,A cab driver finds himself the hostage of an engaging contract killer as he makes his rounds from hit to hit during one night in Los Angeles.
90,  The Town,7.5,A proficient group of thieves rob a bank and hold the manager hostage. Things begin to get complicated when one of the crew members falls in love with her.
91,  The Devil's Advocate,7.5,An exceptionally adept Florida lawyer is offered a job at a high-end New York City law firm with a high-end boss - the biggest opportunity of his career to date.
92,  Eyes Wide Shut,7.5,"A Manhattan doctor embarks on a bizarre, night-long odyssey after his wife's admission of unfulfilled longing."
93,  John Wick,7.5,"John Wick is a former hitman grieving the loss of his true love. When his home is broken into, robbed, and his dog killed, he is forced to return to action to exact revenge."
94,  The Hunger Games: Catching Fire,7.5,Katniss Everdeen and Peeta Mellark become targets of the Capitol after their victory in the 74th Hunger Games sparks a rebellion in the Districts of Panem.
95,  The Conjuring,7.5,Paranormal investigators Ed and Lorraine Warren work to help a family terrorized by a dark presence in their farmhouse.
96,  Source Code,7.5,A soldier wakes up in someone else's body and discovers he's part of an experimental government program to find the bomber of a commuter train within 8 minutes.
97,  28 Days Later,7.5,"Four weeks after a mysterious, incurable virus spreads throughout the United Kingdom, a handful of survivors try to find sanctuary."
98,  The Hurt Locker,7.5,"During the Iraq War, a Sergeant recently assigned to an army bomb squad is put at odds with his squad mates due to his maverick way of handling his work."
99,  John Wick: Chapter 3 - Parabellum,7.4,"John Wick is on the run after killing a member of the international assassins' guild, and with a $14 million price tag on his head, he is the target of hit men and women everywhere."
100,  Mission: Impossible - Rogue Nation,7.4,Ethan and his team take on their most impossible mission yet when they have to eradicate an international rogue organization as highly skilled as they are and committed to destroying the IMF.
101,  The Nice Guys,7.4,"In 1970s Los Angeles, a mismatched pair of private eyes investigate a missing girl and the mysterious death of a porn star."
102,  Limitless,7.4,"A mysterious pill that enables the user to access 100% of his brain's abilities transforms a struggling writer into a financial wizard, but it also puts him in a new world with many dangers."
103,  Looper,7.4,"In 2074, when the mob wants to get rid of someone, the target is sent into the past, where a hired gun awaits - someone like Joe - who one day learns the mob wants to 'close the loop' by sending back Joe's future self for assassination."
104,  X2: X-Men United,7.4,"When anti-mutant Colonel William Stryker kidnaps Professor X and attacks his school, the X-Men must ally with their archenemy Magneto to stop him."
105,  Mission: Impossible - Ghost Protocol,7.4,"The IMF is shut down when it's implicated in the bombing of the Kremlin, causing Ethan Hunt and his new team to go rogue to clear their organization's name."
106,  John Wick: Chapter 2,7.4,"After returning to the criminal underworld to repay a debt, John Wick discovers that a large bounty has been put on his life."
107,  No Time to Die,7.3,"James Bond has left active service. His peace is short-lived when Felix Leiter, an old friend from the CIA, turns up asking for help, leading Bond onto the trail of a mysterious villain armed with dangerous new technology."
108,  Unbreakable,7.3,A man learns something extraordinary about himself after a devastating accident.
109,  The Equalizer,7.3,A man who believes he has put his mysterious past behind him cannot stand idly by when he meets a young girl under the control of ultra-violent Russian gangsters.
110,  Hereditary,7.3,A grieving family is haunted by tragic and disturbing occurrences.
111,  Fast Five,7.3,Dominic Toretto and his crew of street racers plan a massive heist to buy their freedom while in the sights of a powerful Brazilian drug lord and a dangerous federal agent.
112,  Face/Off,7.3,"To foil a terrorist plot, an FBI agent assumes the identity of the criminal who murdered his son via facial transplant surgery, but the crook wakes up prematurely and vows revenge."
113,  Speed,7.3,"An extortionist bomber rigs a Los Angeles city bus to explode if its speed drops below 50 mph, forcing a young cop and a female passenger to keep it moving and save everyone on board."
114,  Tenet,7.3,"Armed with only the word ""Tenet,"" and fighting for the survival of the entire world, CIA operative, The Protagonist, journeys through a twilight world of international espionage on a global mission that unfolds beyond real time."
115,  Split,7.3,Three girls are kidnapped by a man with a diagnosed 23 distinct personalities. They must try to escape before the apparent emergence of a frightful new 24th.
116,  Bullet Train,7.3,Five assassins aboard a swiftly-moving bullet train find out that their missions have something in common.
117,  The Menu,7.2,"A young couple travels to a remote island to eat at an exclusive restaurant where the chef has prepared a lavish menu, with some shocking surprises."
118,  The Hunger Games,7.2,Katniss Everdeen voluntarily takes her younger sister's place in the Hunger Games: a televised competition in which two teenagers from each of the twelve Districts of Panem are chosen at random to fight to the death.
119,  I Am Legend,7.2,"Years after a plague kills most of humanity and transforms the rest into monsters, the sole survivor in New York City struggles valiantly to find a cure."
120,  Now You See Me,7.2,"An FBI agent and an Interpol detective track a team of illusionists who pull off bank heists during their performances, and reward their audiences with the money."
121,  Mission: Impossible,7.2,"An American agent, under false suspicion of disloyalty, must discover and expose the real spy without the help of his organization."
122,  Midsommar,7.1,A couple travels to Northern Europe to visit a rural hometown's fabled Swedish mid-summer festival. What begins as an idyllic retreat quickly devolves into an increasingly violent and bizarre competition at the hands of a pagan cult.
123,  Furious 7,7.1,Deckard Shaw seeks revenge against Dominic Toretto and his family for his comatose brother.
124,  Live Free or Die Hard,7.1,"John McClane is forced to team up with a young computer hacker, Matt Farrell, to stop a master cyber-terrorist called Thomas Gabriel, who wants to shut down the entire nations computer infrastructure in a mass cyber attack."
125,  Snowpiercer,7.1,"In a future where a failed climate change experiment has killed all life except for the survivors who boarded the Snowpiercer (a train that travels around the globe), a new class system emerges."
126,"  I, Robot",7.1,"In 2035, a technophobic cop investigates a crime that may have been perpetrated by a robot, which leads to a larger threat to humanity."
127,  Glass Onion,7.1,"Tech billionaire Miles Bron invites his friends for a getaway on his private Greek island. When someone turns up dead, Detective Benoit Blanc is put on the case."
128,  Passengers,7,A malfunction in a sleeping pod on a spacecraft traveling to a distant colony planet wakes one passenger 90 years early.
129,  The Cabin in the Woods,7,A group of kids go to a remote cabin in the woods where their fate is unknowingly controlled by technicians as part of a world-wide conspiracy where all horror movie clichés are revealed to be part of an elaborate sacrifice ritual.
130,  Cloverfield,7,A group of friends venture deep into the streets of New York on a rescue mission during a rampaging monster attack.
131,  Fast & Furious 6,7,"Hobbs has Dominic and Brian reassemble their crew to take down a team of mercenaries, but Dominic unexpectedly gets sidetracked with facing his presumed deceased girlfriend, Letty."
132,  Mission: Impossible III,6.9,IMF agent Ethan Hunt comes into conflict with a dangerous and sadistic arms dealer who threatens his life and his fiancée in response.
133,  Spectre,6.8,"A cryptic message from James Bond's past sends him on a trail to uncover the existence of a sinister organisation named SPECTRE. With a new threat dawning, Bond learns the terrible truth about the author of all his pain in his most recent missions."
134,  The Fast and the Furious,6.8,Los Angeles police officer Brian O'Conner must decide where his loyalty really lies when he becomes enamored with the street racing world he has been sent undercover to end it.
135,  Signs,6.8,"A widowed former reverend living with his children and brother on a Pennsylvania farm finds mysterious crop circles in their fields, which suggests something more frightening to come."
136,  The Maze Runner,6.8,"Thomas is deposited in a community of boys after his memory is erased, soon learning they're all trapped in a maze that will require him to join forces with fellow ""runners"" for a shot at escape."
137,  In Time,6.7,"In a future where people stop aging at 25, but are engineered to live only one more year, having the means to buy your way out of the situation is a shot at immortal youth. Will Salas is accused of murder and on the run with a hostage."
138,  Armageddon,6.7,"After discovering that an asteroid the size of Texas will impact Earth in less than a month, NASA recruits a misfit team of deep-core drillers to save the planet."
139,  Wanted,6.7,"A frustrated office worker discovers that he is the son of a professional assassin, and that he shares his father's superhuman killing abilities."
